<?xml version="1.0" encoding="UTF-8"?>
<!-- Working draft of XML file format -->

<!-- This file contains the standard OPGEEv4 LCA model. The metadata describintg fields, options,
     and default values is found in attributes.xml. When creating a new model, the user can start
     with the standard model and add/delete/alter elements in a separate file, or simply save copy
     and modify this file. We also (will) support site- and user-specific XML template files that
     define custom starting points.
     -->
<Model xmlns:xsi="http://www.w3.org/2001/XMLSchema-instance" 
       xsi:noNamespaceSchemaLocation="opgee.xsd">
	<Analysis name="default">
		<!-- Global parameters -->
		<FunctionalUnit>oil</FunctionalUnit>
		<EnergyBasis>LHV</EnergyBasis>
		
		<!-- Are variables different than parameters? -->
		<!-- Are variables all global to the Analysis, or stored per element, e.g., Field, or both? -->
		<Variables>
			<A name="v1" type="float" unit="kWh/day">123.5</A>
			<A name="v2" unit="zzz">434</A>
		</Variables>

		<Field name="US_FW">
			<A name="location">USA</A>
			<A name="is_offshore">0</A>
			<A name="age">86</A>
			<A name="depth">4936</A>
			<A name="oil_prod">101295</A>
			<A name="num_prod_wells">41539</A>
			<A name="num_water_inj_wells">34426</A>
			<A name="well_diam" >3.01</A>
			<A name="prod_index">37.53</A>
			<A name="res_press">887.31</A>
			<A name="res_temp">70.84</A>
			
			<!-- Where should Streams be defined? At the field level? Within the Process
			     that consumes them? (That should be unique, right?) Is there any need to
			     specify the source or destination then?
			     -->
			<Stream number="1" name="oil in reservoir" src="_" dst="ReservoirWellInterface">
				<Temperature unit="degF">70.8</Temperature>
				<Pressure unit="psia">887.3</Pressure>
				<Component name="oil" phase="liquid" unit="tonne/d">14555.9</Component>
				<Component name="H2O" phase="liquid" unit="tonne/d">2037.8</Component>
			</Stream>
			
			<Stream number="100" name="water in reservoir" src="_" dst="ReservoirWellInterface">
				<Temperature unit="degF">70.8</Temperature>
				<Pressure unit="psia">887.3</Pressure>
				<Component name="H2O" phase="liquid" unit="tonne/d">255636.1</Component>
			</Stream>
			
			<Stream number="25" name="gas from reservoir" src="_" dst="ReservoirWellInterface">
				<Temperature unit="degF">70.8</Temperature>
				<Pressure unit="psia">887.3</Pressure>
				<Component name="N2" phase="gas" unit="tonne/d">519.9</Component>
				<Component name="CO2" phase="gas" unit="tonne/d">8858.8</Component>
				<Component name="CH4" phase="gas" unit="tonne/d">22288.1</Component>
				<Component name="C2H6" phase="gas" unit="tonne/d">4495.1</Component>
				<Component name="C3H8" phase="gas" unit="tonne/d">4399.9</Component>
				<Component name="C4H10" phase="gas" unit="tonne/d">284.4</Component>
				<Component name="H2S" phase="gas" unit="tonne/d">1.5</Component>
			</Stream>
			
			<Aggregator name="Exploration_and_development">
				<Aggregator name="Exploration">
					<Process class="SurveyVehicle">
						<A name="type">ship</A>
						<A name="vehicle_weight" unit="tons">124</A>
						<A name="distance" unit="mi">2342</A>
					</Process>
					<Process class="SurveyVehicle">
						<A name="type">truck</A>
						<A name="vehicle_weight" unit="tons">123</A>
						<A name="distance" unit="mi">2342</A>
					</Process>
				</Aggregator>
				<Aggregator name="FieldDevelopment">
					<Process class="Drilling">
						<A name="productivity">medium</A>
						<A name="total_wells">2500</A>
					</Process>
					
					<Process class="ReservoirWellInterface">
						<A name="x">0</A>
					</Process>
					
					<Process class="LandUse"/>
				</Aggregator>
				<Process class="Fracking"/>
			</Aggregator>
			<Aggregator name="Production_Stage">
				<Process class="FluidProduction"/>
				<Process class="FluidInjection"/>
				<Process class="BitumenMining"/>
				<Process class="Maintenance"/>
			</Aggregator>
			<Aggregator name="SurfaceProcessing_Stage">
				<Process class="CrudeSeparationAndHandling"/>
				<Process class="CrudeStorage"/>
				<Process class="BitumenUpgradingOrDistilation"/>
				<Process class="WasteTreatmentAndDisposal"/>
			</Aggregator>
			<Aggregator name="Transport_Stage">
				<Process class="CrudeTransport"/>
			</Aggregator>
		</Field>
	</Analysis>
</Model>
