<?xml version='1.0' encoding='UTF-8'?>
<Model xmlns:xsi="http://www.w3.org/2001/XMLSchema-instance" xsi:noNamespaceSchemaLocation="../../opgee/etc/opgee.xsd">

  <Analysis name="test-mcs">
    <A name="functional_unit">oil</A>
    <A name="GWP_horizon">100</A>
    <A name="GWP_version">AR5</A>

    <FieldRef name="test-mcs"/>
  </Analysis>

  <Field name="test-mcs">
    <A name="downhole_pump">0</A>
    <A name="water_reinjection">1</A>
    <A name="natural_gas_reinjection">1</A>
    <A name="water_flooding">0</A>
    <A name="gas_lifting">1</A>
    <A name="gas_flooding">0</A>
    <A name="steam_flooding">0</A>
    <A name="oil_sands_mine">None</A>
    <A name="country">Angola</A>
    <A name="name">Girassol</A>
  </Field>

</Model>
