<?xml version="1.0" encoding="UTF-8"?>
<Model xmlns:xsi="http://www.w3.org/2001/XMLSchema-instance" xsi:noNamespaceSchemaLocation="../../opgee/etc/opgee.xsd">

	<Analysis name="test">
	  <A name="functional_unit">oil</A>
	  <A name="energy_basis">LHV</A>
	  <A name="GWP_horizon">100</A>
	  <A name="GWP_version">AR5</A>
	  <Group regex="1">.*Foo.*</Group>
	</Analysis>

	<Field name="test1">
		<Group>Foo</Group>
		<A name="country">USA</A>
		<Process class="After"/>

		<Process class="ProcA" desc="Test process 1"/>
		<Process class="ProcB" desc="Test process 2"/>
		<Process class="Boundary" boundary="Production"/>

		<Stream src="ProcB" dst="ProductionBoundary"/>
	</Field>

	<Field name="test2">
		<Group>MatchesFooAlso</Group>
		<A name="country">USA</A>

		<Process class="ProcA" desc="Test process 1"/>
		<Process class="ProcB" desc="Test process 2"/>
		<Process class="Boundary" boundary="Production"/>

		<Stream src="ProcB" dst="ProductionBoundary"/>
	</Field>

	<Field name="test3">
		<Group>Bar</Group>
		<A name="country">USA</A>

		<Process class="ProcA" desc="Test process 1"/>
		<Process class="ProcB" desc="Test process 2"/>
		<Process class="Boundary" boundary="Production"/>

		<Stream src="ProcB" dst="ProductionBoundary"/>
	</Field>

</Model>
